{
  "participant_id": "synthetic_p001",
  "meal_timestamp": "2026-10-08T12:30:00Z",
  "model_version": "v0.1.0",
  "data_source": "synthetic_dev",
  "prediction_status": "personalized",
  "points": [
    {
      "minute": 0,
      "glucose_mg_dl": 105.0,
      "lower_mg_dl": null,
      "upper_mg_dl": null
    },
    {
      "minute": 5,
      "glucose_mg_dl": 108.2,
      "lower_mg_dl": null,
      "upper_mg_dl": null
    },
    {
      "minute": 10,
      "glucose_mg_dl": 111.3,
      "lower_mg_dl": null,
      "upper_mg_dl": null
    },
    {
      "minute": 15,
      "glucose_mg_dl": 114.5,
      "lower_mg_dl": null,
      "upper_mg_dl": null
    },
    {
      "minute": 20,
      "glucose_mg_dl": 117.7,
      "lower_mg_dl": null,
      "upper_mg_dl": null
    },
    {
      "minute": 25,
      "glucose_mg_dl": 120.8,
      "lower_mg_dl": null,
      "upper_mg_dl": null
    },
    {
      "minute": 30,
      "glucose_mg_dl": 124.0,
      "lower_mg_dl": null,
      "upper_mg_dl": null
    },
    {
      "minute": 35,
      "glucose_mg_dl": 127.7,
      "lower_mg_dl": null,
      "upper_mg_dl": null
    },
    {
      "minute": 40,
      "glucose_mg_dl": 131.3,
      "lower_mg_dl": null,
      "upper_mg_dl": null
    },
    {
      "minute": 45,
      "glucose_mg_dl": 135.0,
      "lower_mg_dl": null,
      "upper_mg_dl": null
    },
    {
      "minute": 50,
      "glucose_mg_dl": 138.7,
      "lower_mg_dl": null,
      "upper_mg_dl": null
    },
    {
      "minute": 55,
      "glucose_mg_dl": 142.3,
      "lower_mg_dl": null,
      "upper_mg_dl": null
    },
    {
      "minute": 60,
      "glucose_mg_dl": 146.0,
      "lower_mg_dl": null,
      "upper_mg_dl": null
    },
    {
      "minute": 65,
      "glucose_mg_dl": 144.8,
      "lower_mg_dl": null,
      "upper_mg_dl": null
    },
    {
      "minute": 70,
      "glucose_mg_dl": 143.7,
      "lower_mg_dl": null,
      "upper_mg_dl": null
    },
    {
      "minute": 75,
      "glucose_mg_dl": 142.5,
      "lower_mg_dl": null,
      "upper_mg_dl": null
    },
    {
      "minute": 80,
      "glucose_mg_dl": 141.3,
      "lower_mg_dl": null,
      "upper_mg_dl": null
    },
    {
      "minute": 85,
      "glucose_mg_dl": 140.2,
      "lower_mg_dl": null,
      "upper_mg_dl": null
    },
    {
      "minute": 90,
      "glucose_mg_dl": 139.0,
      "lower_mg_dl": null,
      "upper_mg_dl": null
    },
    {
      "minute": 95,
      "glucose_mg_dl": 135.5,
      "lower_mg_dl": null,
      "upper_mg_dl": null
    },
    {
      "minute": 100,
      "glucose_mg_dl": 132.0,
      "lower_mg_dl": null,
      "upper_mg_dl": null
    },
    {
      "minute": 105,
      "glucose_mg_dl": 128.5,
      "lower_mg_dl": null,
      "upper_mg_dl": null
    },
    {
      "minute": 110,
      "glucose_mg_dl": 125.0,
      "lower_mg_dl": null,
      "upper_mg_dl": null
    },
    {
      "minute": 115,
      "glucose_mg_dl": 121.5,
      "lower_mg_dl": null,
      "upper_mg_dl": null
    },
    {
      "minute": 120,
      "glucose_mg_dl": 118.0,
      "lower_mg_dl": null,
      "upper_mg_dl": null
    }
  ],
  "glucose_at_minutes": {
    "30": 124.0,
    "60": 146.0,
    "90": 139.0,
    "120": 118.0
  },
  "metrics": {
    "peak_mg_dl": 146.0,
    "peak_delta_mg_dl": 41.0,
    "time_to_peak_minutes": 60,
    "incremental_auc_mg_dl_min": 3015.0
  },
  "drivers": [
    {
      "feature": "carbs_g",
      "contribution_mg_dl": 12.5,
      "explanation": "Model-based contribution at the peak horizon; association within the model, not a causal physiological effect."
    },
    {
      "feature": "premeal_glucose_mg_dl",
      "contribution_mg_dl": -4.2,
      "explanation": "Model-based contribution at the peak horizon; association within the model, not a causal physiological effect."
    },
    {
      "feature": "participant_calibration",
      "contribution_mg_dl": 3.1,
      "explanation": "Shrunk participant-specific residual offset learned from this participant's earlier training meals only."
    }
  ],
  "uncertainty_status": "not_calibrated",
  "limitations": [
    "Synthetic research demonstration; not medical advice and not for clinical decision-making.",
    "Curve shape between the 30/60/90/120-minute learned horizons is linearly interpolated, so the reported peak time is resolved only to those knots."
  ]
}
